[
  {
    "sourceModule": "M1_source_scanner",
    "scanTargetId": "t17_handoff",
    "filePath": "seed_corpus\\go\\real_findings.go",
    "lineNumber": 4,
    "language": "go",
    "library": "crypto/sha1",
    "rawSignal": "crypto/sha1",
    "detectedPrimitive": "SHA1",
    "primitiveCategory": "hash",
    "keySizeBits": null,
    "mode": null,
    "confidence": 0.85,
    "detectionTier": "ast"
  },
  {
    "sourceModule": "M1_source_scanner",
    "scanTargetId": "t17_handoff",
    "filePath": "seed_corpus\\go\\real_findings.go",
    "lineNumber": 5,
    "language": "go",
    "library": "crypto/rsa",
    "rawSignal": "crypto/rsa",
    "detectedPrimitive": "RSA",
    "primitiveCategory": "asymmetric-cipher",
    "keySizeBits": null,
    "mode": null,
    "confidence": 0.85,
    "detectionTier": "ast"
  },
  {
    "sourceModule": "M1_source_scanner",
    "scanTargetId": "t17_handoff",
    "filePath": "seed_corpus\\go\\real_findings.go",
    "lineNumber": 6,
    "language": "go",
    "library": "crypto/aes",
    "rawSignal": "crypto/aes",
    "detectedPrimitive": "AES",
    "primitiveCategory": "symmetric-cipher",
    "keySizeBits": null,
    "mode": null,
    "confidence": 0.85,
    "detectionTier": "ast"
  },
  {
    "sourceModule": "M1_source_scanner",
    "scanTargetId": "t17_handoff",
    "filePath": "seed_corpus\\java\\RealFindings.java",
    "lineNumber": 5,
    "language": "java",
    "library": null,
    "rawSignal": "MessageDigest.getInstance('SHA-1')",
    "detectedPrimitive": "SHA1",
    "primitiveCategory": "hash",
    "keySizeBits": null,
    "mode": null,
    "confidence": 0.95,
    "detectionTier": "ast"
  },
  {
    "sourceModule": "M1_source_scanner",
    "scanTargetId": "t17_handoff",
    "filePath": "seed_corpus\\java\\RealFindings.java",
    "lineNumber": 6,
    "language": "java",
    "library": null,
    "rawSignal": "Signature.getInstance(\"SHA1withRSA\")",
    "detectedPrimitive": "RSA",
    "primitiveCategory": "asymmetric-cipher",
    "keySizeBits": null,
    "mode": null,
    "confidence": 0.95,
    "detectionTier": "ast"
  },
  {
    "sourceModule": "M1_source_scanner",
    "scanTargetId": "t17_handoff",
    "filePath": "seed_corpus\\java\\RealFindings.java",
    "lineNumber": 7,
    "language": "java",
    "library": null,
    "rawSignal": "Cipher.getInstance(\"AES/ECB/PKCS5Padding\")",
    "detectedPrimitive": "AES",
    "primitiveCategory": "symmetric-cipher",
    "keySizeBits": null,
    "mode": "ECB",
    "confidence": 0.95,
    "detectionTier": "ast"
  },
  {
    "sourceModule": "M1_source_scanner",
    "scanTargetId": "t17_handoff",
    "filePath": "seed_corpus\\javascript\\real_findings.js",
    "lineNumber": 3,
    "language": "javascript",
    "library": null,
    "rawSignal": "crypto.createHash('sha1')",
    "detectedPrimitive": "SHA1",
    "primitiveCategory": "hash",
    "keySizeBits": null,
    "mode": null,
    "confidence": 0.95,
    "detectionTier": "ast"
  },
  {
    "sourceModule": "M1_source_scanner",
    "scanTargetId": "t17_handoff",
    "filePath": "seed_corpus\\javascript\\real_findings.js",
    "lineNumber": 4,
    "language": "javascript",
    "library": null,
    "rawSignal": "crypto.generateKeyPairSync('rsa', { modulusLength: 2048 })",
    "detectedPrimitive": "RSA-2048",
    "primitiveCategory": "asymmetric-cipher",
    "keySizeBits": 2048,
    "mode": null,
    "confidence": 0.95,
    "detectionTier": "ast"
  },
  {
    "sourceModule": "M1_source_scanner",
    "scanTargetId": "t17_handoff",
    "filePath": "seed_corpus\\javascript\\real_findings.js",
    "lineNumber": 4,
    "language": "javascript",
    "library": null,
    "rawSignal": "crypto.generateKeyPairSync('rsa', { modulusLength: 2048 })",
    "detectedPrimitive": "RSA",
    "primitiveCategory": "asymmetric-cipher",
    "keySizeBits": 2048,
    "mode": null,
    "confidence": 0.95,
    "detectionTier": "ast"
  },
  {
    "sourceModule": "M1_source_scanner",
    "scanTargetId": "t17_handoff",
    "filePath": "seed_corpus\\python\\real_findings.py",
    "lineNumber": 4,
    "language": "python",
    "library": null,
    "rawSignal": "hashlib.sha1(b\"x\")",
    "detectedPrimitive": "SHA1",
    "primitiveCategory": "hash",
    "keySizeBits": null,
    "mode": null,
    "confidence": 0.95,
    "detectionTier": "ast"
  },
  {
    "sourceModule": "M1_source_scanner",
    "scanTargetId": "t17_handoff",
    "filePath": "seed_corpus\\python\\real_findings.py",
    "lineNumber": 5,
    "language": "python",
    "library": null,
    "rawSignal": "hashlib.md5(b\"x\")",
    "detectedPrimitive": "MD5",
    "primitiveCategory": "hash",
    "keySizeBits": null,
    "mode": null,
    "confidence": 0.95,
    "detectionTier": "ast"
  },
  {
    "sourceModule": "M1_source_scanner",
    "scanTargetId": "t17_handoff",
    "filePath": "seed_corpus\\python\\real_findings.py",
    "lineNumber": 7,
    "language": "python",
    "library": null,
    "rawSignal": "rsa.generate_private_key(public_exponent=65537, key_size=2048)",
    "detectedPrimitive": "RSA-2048",
    "primitiveCategory": "asymmetric-cipher",
    "keySizeBits": 2048,
    "mode": null,
    "confidence": 0.95,
    "detectionTier": "ast"
  },
  {
    "sourceModule": "M1_source_scanner",
    "scanTargetId": "t17_handoff",
    "filePath": "seed_corpus\\python\\real_findings.py",
    "lineNumber": 7,
    "language": "python",
    "library": null,
    "rawSignal": "rsa.generate_private_key(public_exponent=65537, key_size=2048)",
    "detectedPrimitive": "RSA",
    "primitiveCategory": "asymmetric-cipher",
    "keySizeBits": 2048,
    "mode": null,
    "confidence": 0.95,
    "detectionTier": "ast"
  },
  {
    "sourceModule": "M1_source_scanner",
    "scanTargetId": "t17_handoff",
    "filePath": "seed_corpus\\python\\real_findings.py",
    "lineNumber": 9,
    "language": "python",
    "library": null,
    "rawSignal": "modes.ECB()",
    "detectedPrimitive": "AES",
    "primitiveCategory": "symmetric-cipher",
    "keySizeBits": null,
    "mode": null,
    "confidence": 0.95,
    "detectionTier": "ast"
  },
  {
    "sourceModule": "M2_dep_binary_scanner",
    "scanTargetId": "t17_handoff",
    "filePath": "seed_corpus\\binary\\openssl_v1_0_2_strings.txt",
    "lineNumber": 1,
    "language": null,
    "library": null,
    "rawSignal": "# EXPECTED_FINDINGS: [{\"primitive\":\"OpenSSL 1.0.2\",\"category\":\"key-management\",\"line\":1,\"mode\":\"deprecated\"},{\"primitive\":\"RSA_new\",\"category\":\"asymmetric-cipher\",\"line\":2},{\"primitive\":\"MD5_Init\",\"category\":\"hash\",\"line\":5},{\"primitive\":\"SHA1_Init\",\"category\":\"hash\",\"line\":6},{\"primitive\":\"DES_set_key\",\"category\":\"symmetric-cipher\",\"line\":7,\"mode\":\"DES\"},{\"primitive\":\"RC4\",\"category\":\"symmetric-cipher\",\"line\":8,\"mode\":\"RC4\"}]",
    "detectedPrimitive": "OpenSSL 1.0.2",
    "primitiveCategory": "key-management",
    "keySizeBits": null,
    "mode": "deprecated",
    "confidence": 0.7,
    "detectionTier": "binary-string"
  },
  {
    "sourceModule": "M2_dep_binary_scanner",
    "scanTargetId": "t17_handoff",
    "filePath": "seed_corpus\\binary\\openssl_v1_0_2_strings.txt",
    "lineNumber": 1,
    "language": null,
    "library": null,
    "rawSignal": "# EXPECTED_FINDINGS: [{\"primitive\":\"OpenSSL 1.0.2\",\"category\":\"key-management\",\"line\":1,\"mode\":\"deprecated\"},{\"primitive\":\"RSA_new\",\"category\":\"asymmetric-cipher\",\"line\":2},{\"primitive\":\"MD5_Init\",\"category\":\"hash\",\"line\":5},{\"primitive\":\"SHA1_Init\",\"category\":\"hash\",\"line\":6},{\"primitive\":\"DES_set_key\",\"category\":\"symmetric-cipher\",\"line\":7,\"mode\":\"DES\"},{\"primitive\":\"RC4\",\"category\":\"symmetric-cipher\",\"line\":8,\"mode\":\"RC4\"}]",
    "detectedPrimitive": "RSA",
    "primitiveCategory": "asymmetric-cipher",
    "keySizeBits": null,
    "mode": null,
    "confidence": 0.7,
    "detectionTier": "binary-string"
  },
  {
    "sourceModule": "M2_dep_binary_scanner",
    "scanTargetId": "t17_handoff",
    "filePath": "seed_corpus\\binary\\openssl_v1_0_2_strings.txt",
    "lineNumber": 1,
    "language": null,
    "library": null,
    "rawSignal": "# EXPECTED_FINDINGS: [{\"primitive\":\"OpenSSL 1.0.2\",\"category\":\"key-management\",\"line\":1,\"mode\":\"deprecated\"},{\"primitive\":\"RSA_new\",\"category\":\"asymmetric-cipher\",\"line\":2},{\"primitive\":\"MD5_Init\",\"category\":\"hash\",\"line\":5},{\"primitive\":\"SHA1_Init\",\"category\":\"hash\",\"line\":6},{\"primitive\":\"DES_set_key\",\"category\":\"symmetric-cipher\",\"line\":7,\"mode\":\"DES\"},{\"primitive\":\"RC4\",\"category\":\"symmetric-cipher\",\"line\":8,\"mode\":\"RC4\"}]",
    "detectedPrimitive": "MD5",
    "primitiveCategory": "hash",
    "keySizeBits": null,
    "mode": null,
    "confidence": 0.7,
    "detectionTier": "binary-string"
  },
  {
    "sourceModule": "M2_dep_binary_scanner",
    "scanTargetId": "t17_handoff",
    "filePath": "seed_corpus\\binary\\openssl_v1_0_2_strings.txt",
    "lineNumber": 1,
    "language": null,
    "library": null,
    "rawSignal": "# EXPECTED_FINDINGS: [{\"primitive\":\"OpenSSL 1.0.2\",\"category\":\"key-management\",\"line\":1,\"mode\":\"deprecated\"},{\"primitive\":\"RSA_new\",\"category\":\"asymmetric-cipher\",\"line\":2},{\"primitive\":\"MD5_Init\",\"category\":\"hash\",\"line\":5},{\"primitive\":\"SHA1_Init\",\"category\":\"hash\",\"line\":6},{\"primitive\":\"DES_set_key\",\"category\":\"symmetric-cipher\",\"line\":7,\"mode\":\"DES\"},{\"primitive\":\"RC4\",\"category\":\"symmetric-cipher\",\"line\":8,\"mode\":\"RC4\"}]",
    "detectedPrimitive": "SHA1",
    "primitiveCategory": "hash",
    "keySizeBits": null,
    "mode": null,
    "confidence": 0.7,
    "detectionTier": "binary-string"
  },
  {
    "sourceModule": "M2_dep_binary_scanner",
    "scanTargetId": "t17_handoff",
    "filePath": "seed_corpus\\binary\\openssl_v1_0_2_strings.txt",
    "lineNumber": 1,
    "language": null,
    "library": null,